{
  "pr_number": 1,
  "trigger_source": "bot",
  "actions": [
    {
      "type": "fix",
      "finding": "Nil pointer dereference when input is empty.",
      "path": "main.go",
      "description": "Added nil check before accessing the field."
    }
  ],
  "summary": "Fixed the nil pointer dereference by adding an input validation check.",
  "tests_passed": true,
  "files_changed": ["main.go"]
}
